ids,descriptions
133746,Extreme Networks Named to Computerworlds 2023 List of Best Places to Work in IT Over 50000 customers globally trust our endtoend clouddriven networking solutions and rely on our toprated services and support to accelerate their digital transformation efforts and deliver progress like never before and with double digit growth year over year no provider is better positioned to deliver better outcomes on scale than Extreme We believe in walking the walkof our strong core values which enable us to successfully advance together Diversity and Inclusion is a vital part of our values and beliefs and were proud to foster an environment where every Extreme employee can thriveCome become part of something big with us We are a global leader with hubs in North America South America Asia Pacific Europe and the Middle East Ownership of sales within a territory including opportunities Partners and Customer accounts The VSAM works in collaboration with the Regional Account Executive to drive the territory business towards achievement of the annual operating plan goal Role Responsibilities Perform against and achieve the territory annual operating plan goal every quarter in collaboration with the Regional Account Executives Sales and Account Management via deskbased activity Maintain and develop relationships with Channel Partners to drive pipeline creation Manage and close pipeline within an allocated territory alongside a virtual support team of Regional Account Executive Virtual Systems Engineer Partner Account Manager Inside Distribution Partner Account Manager Organize campaigns outbound activity and contact within the territory nonnamed account base to drive Xsell and Upsell to your existing customers Assist with Partner education and training appropriate to the Partners you are engaged with ability to drive pipeline creation Ensure Partners you are engaged with can effectively position and sell Extreme Networks solutions Scale your business through the Channel Marketing  Demand Generation Personally and via Channel Partners organize and perform the follow up of Marketing generated leadflow for your defined territory Work with Extreme Networks Partners and Channel Programs Teams to drive demand generation through the Extreme Networks Channel program Negotiate with and through Partners in competitive situations to ensure that Extreme Networks is the preferred vendor on customer and prospective opportunities Ensure all sales activities are recorded in SFDC Align with the Regional Sales Leads strategy for the geography The VSAM should also team with Extreme Networks Channel Stakeholders and other virtual team members including the Regional Account Executive Virtual Systems Engineer Partner Account Manager Inside Distribution Partner Account Manager Fluent Dutch and English Speaker The above list of job duties is not exclusive or exhaustive and you may be required to undertake such tasks as may reasonably be expected within the scope of your role LIRemote Additional Information Extreme Networks Inc EXTR creates effortless networking experiences that enable all of us to advance We push the boundaries of technology leveraging the powers of machine learning artificial intelligence analytics and
133747,Its an exciting time to join Gearset In the last few years weve rocketed from a 7 person startup to nearly 240 people and were only just getting started As a productdriven company founded by engineers we know the value of a great engineering culture and were looking for great developers to join a team built from the ground up on trust teamwork and tight feedback loops Our deliberate lack of unnecessary hierarchy and our focus on the job to be done one of our core values means youll work from day one on making thousands of businesses around the world more effective Working closely with users youll see the difference the features you build have on millions of people developing on Salesforce and how they apply DevOps best practices to their development and release process Our culture of trust transparency and collaboration means everyone at Gearset is given the autonomy to succeed and are trusted to do good work We only add process when it helps us get things done and were allergic to pointless meetings We live by our core engineering values which arent just nice wordsthey guide us through daytoday challenges and are the foundation of how we work together We know that learning and development is important to great engineers and at Gearset youll find it comes in many forms From the chance to collaborate with other really smart people who help you learn and raise your game to having an annual learning and development budget for conferences events and courses All this coupled with flexible working and a top end hardware setup of your choosing you can see that Gearset has built a culture to help you succeed Our engineering team is driven by a genuine desire to make the lives of our customers easier and we do that by helping each other deliver consistently outstanding work Were confident in our product market potential and we have big plans for the future Whats the opportunity for a Senior Software Engineer at Gearset Our small teams have responsibility for product goals not building specific features which means people working on the problems have the freedom to decide the tactics they use to solve the root causes Youll have the opportunity to impact what we build as well as how we build it A great team does their best work with context and feedback  theres no substitute for talking directly with the people impacted by our work Engineers work across the business and talk directly to customers and partners to ensure were solving the most pressing problems in the most effective way Our tech stack includes a mix of cuttingedge and proven technologies such as C React Typescript Postgres AWS and Docker Youll become familiar with our pragmatically chosen stack but youll also help us define what great looks like We release Gearset multiple times a day and can switch
133748,Extreme Networks Named to Computerworlds 2023 List of Best Places to Work in IT Over 50000 customers globally trust our endtoend clouddriven networking solutions and rely on our toprated services and support to accelerate their digital transformation efforts and deliver progress like never before and with double digit growth year over year no provider is better positioned to deliver better outcomes on scale than Extreme We believe in walking the walkof our strong core values which enable us to successfully advance together Diversity and Inclusion is a vital part of our values and beliefs and were proud to foster an environment where every Extreme employee can thriveCome become part of something big with us We are a global leader with hubs in North America South America Asia Pacific Europe and the Middle East Systems Engineer There has never been a better time to join Extreme Extreme Systems Engineer provides technology and product consulting technical sales support for various account opportunities performs highlevel and indepth technical presentations for customers prospects and Extreme channel partners in the territory of responsibility Extreme Systems Engineer also provides support for RFIRFP responses organizes and leads Proof of Concept activities designs solutions meeting customer requirements Systems Engineer is also required to participate as a specialization assigned virtual teams and contribute to other team activities DomesticInternational travel will be required Candidate Requirements  Excellent presentation skills fluent in French and English Strong successful presales engineering track record in the industry and territory in a similar position is necessary A sound knowledge of fundamental networking technologies o Layer 23 switching o IPv4v6 routing concepts o Overlay networking VPNso WiFi operation and design o Network security principles Knowledge and practical experience in these areas are an advantageo Cloud technologies and Cloudbased network management platformso Compute and network virtualization principles o Network management and orchestration softwareo SDWAN o Automation scripting and APIs Ability to work as a part of customer project teams on design and PoC labs setting criteria for successful PoCs and overall solution designs Tenacity and perseverance customer advocate facing internally to Extreme Ability to build develop and maintain a network of people at the customerpartner side independent of sales being accepted as the trusted advisor When growing the business the willingness to assume a teamlead role for the account team whenif business requires additional resources Experience working with partners is a plus for technical training on products Major account experience and experience in closing deals is necessary Extreme Networks certifications are desirable but not mandatory  Recognized industry certifications is a plus  Ability to demonstrate knowledge and understanding of future trends and market directions Ability to support customer evaluations demonstrations and detailed design requirements Good general handson lab experience is requiredLIRemote Additional Information Extreme Networks Inc EX
133749,Extreme Networks Named to Computerworlds 2023 List of Best Places to Work in IT Over 50000 customers globally trust our endtoend clouddriven networking solutions and rely on our toprated services and support to accelerate their digital transformation efforts and deliver progress like never before and with double digit growth year over year no provider is better positioned to deliver better outcomes on scale than Extreme We believe in walking the walkof our strong core values which enable us to successfully advance together Diversity and Inclusion is a vital part of our values and beliefs and were proud to foster an environment where every Extreme employee can thriveCome become part of something big with us We are a global leader with hubs in North America South America Asia Pacific Europe and the Middle East Account Executive  Mexico  New and Existing Accounts  Utilize your Solutions Sales expertise to prospect and capture new Enterprise business while growing the existing install base  Provide indepth business planning and reporting monthly forecast weekly commit pipeline development etc  Extreme Partners  Will assist in the continuing relationship with our existing partner eco system along with recruiting new relationships with key partners in the regions Requirements  Must be fluent in both English and Spanish  Proven hunter with a history of developing new prospective customers and collaborating across crossfunctional internal teams ensuring target quotas are achieved and exceeded  Driven to successfully close large complex deals amid a mix of new business established accounts and channel management  Strong executive presence and communications skills with effective Solution Selling skills into Enterprise networking environments at the CXO levels  Strong Business plan development and forecasting experience  Must be a selfstarter with high energy and drive who takes initiative and works with limited direction  A highly trusted business partner who maintains and expect high standards for self and team  An accomplished Enterprise Account Executive with established account base strong regional Customer Channel Partner and Distribution relationships  A very strong background and strong relationships relative to both the Channel and Distribution Channels in both Central America and the Caribbean  Relevant industrycompetitive knowledge  Proven and verifiable track record in exceeding sales quotas achieving Club  Strong Competitive Industry and Product Knowledge with ability to articulate the Extreme Networks Business Value Proposition Additional Information Extreme Networks Inc EXTR creates effortless networking experiences that enable all of us to advance We push the boundaries of technology leveraging the powers of machine learning artificial intelligence analytics and automation Over 50000 customers globally trust our endtoend clouddriven networking solutions and rely on our toprated services and support to accelerate their digital transformation efforts and deliver progress like never before For more information visit Extremeswebsiteor follow us on Twitter LinkedIn and Facebook We encourage people
133750,Who We Are At Firstup our mission is to improve the employee experience at every moment that matters large and small As the communication pipeline for the worlds workforce we now serve 40 of the Fortune 100 companies reaching and connecting more than 17 million employees daily Our employees are experts in the employee experience workforce communications and technology Joining Firstup means joining a movement to make work better for every worker As the worlds first intelligent communication platform Firstup meaningfully engages employees at every moment from hire to retire and delivers engagement insights to help companies support promote and retain their talent Our movement has taken root and is evident in our worldclass customer base Now we need your help Ready to make a difference in the world Our Values Every employee is an owner with responsibility and credit for our progress Leadership is in our build and we see change as a catalyst for improvement We win as a team committed to help our coworkers and customers thrive We are looking for a skilled QA Engineer to join our team The QA Engineer will be responsible for ensuring the quality of our software products through various testing methods including manual testing and automated testing The ideal candidate will have a strong attention to detail excellent problemsolving skills and experience with software testing methodologies and tools As a Product Engineering team we pride ourselves in the delivering quality software that people love to use and embrace large scale business and technical challenges Operating as a global team we are organized into selfsufficient agile feature teams to allow maximum autonomy and speed We build in a modern evolving stack C Net Core Ruby React PostgreSQL leveraging new technologies as needed We operate with shared trust and no egos and enjoy being in this together to collaborate on the challenges of a rapidly scaling business This is a remote role with multiple openings throughout the UK Responsibilities Define the test strategy for key areas of the product and lead the execution to achieve a highquality market leading product Analyse requirements and review technical design Design develop and implement test plans and test cases to achieve a highquality market leading product Create and maintain robust test automation frameworks for all layers of the platform including Web Mobile and API Contribute to the creation of user stories and acceptance criteria to ensure the products meet customer requirements Participate in code reviews to identify potential issues early in development cycle Continuously improve the QA process by identifying areas for improvement and suggesting solutions Qualifications Computer ScienceInformation Systems background with 3 years in QA SrLead experience is a plus Experience with SaaS applications web service APIs and mobile applications Handson relational database experience with eg PostgreSQL MSSQL or MySQL Experience of iterative testing in a fastpaced agile environment Knowledge of programming languages such as Ruby C Java is very helpful
133751,The venteprivee group has consolidated its various European brands together made up of 6000 employees under one unified conglomerate Veepee This coalescence marks a new chapter in its European history With Privalia venteexclusive Designer  Friends Eboutic and venteprivee Veepee achieved a 37 billion Euro turnover as of 2018 Present in 14 countries now Veepee is taking a leading role in the European digital commerce landscape  DESCRIPTION DU POSTE The CRM Project Manager is responsible for the implementation of the strategic CRM projects in order to accelerate the positive dynamic of all our segments The scope will be mainly on anti churn  reactivation of our active members by integrating relevant triggers and deploying new mechanics to develop our member base  MISSIONS Delegation actions managed by the CRM Project Manager in complete autonomy and responsibility Operational management of the anti churn  reactivation strategy for the group to ensure the reach of our business goalsFollowup of the performances and dashboards definition Participate in the strategy definition to reach our objectives of anti churn  reactivation of active members with a segmented approach Define and execute Veepee CRM strategy on anti churn  reactivation with the support of internal teams and products tech agency dataTest new channels and mechanics to increase our stickinessLead and execute the improvement of the performance of daily member communicationDeploy CRM mechanic and cycles to qualify the database to increase health of our database Followup the performance and the profitability of the campaigns deployedMonitor of the CRM actions and cycles deployed by the Project management team to animate the member lifecycle marketing pressure management reach optimization CRM cyclesBuilding of actionable report at a Group level to share performance and deploy quickwinsIdentify business opportunities regarding the result raise alerts and propose optimizations Be the main entry point to all the Marketing local market teams on anti churn  reactivation scopeAnimate the operational meetings with product and local Marketing teamsConsolidate the group performance and ensure every market has the good level of informationDeploy transversal projects at a group level and harmonize CRM programs  PR REQUIS Master degree in Marketing or business school bac 5Similar role with 5 years in CRM B2C in various companies with at least 1 ecommerce company Soft skills Business orientedTeam spirit and collaborationProblem solverAnalytics skillsRigour and accuracyAutonomy and organizationLeadership Technical skills Good knowledge of technical tools and CRM KPIsYou have already use several marketing automation toolsEnglish written and spoken  AVANTAGES  Prime variable  Participation  intressement Tltravail possible jusqu 3 jourssemaine
133752,Extreme Networks Named to Computerworlds 2023 List of Best Places to Work in IT Over 50000 customers globally trust our endtoend clouddriven networking solutions and rely on our toprated services and support to accelerate their digital transformation efforts and deliver progress like never before and with double digit growth year over year no provider is better positioned to deliver better outcomes on scale than Extreme We believe in walking the walkof our strong core values which enable us to successfully advance together Diversity and Inclusion is a vital part of our values and beliefs and were proud to foster an environment where every Extreme employee can thriveCome become part of something big with us We are a global leader with hubs in North America South America Asia Pacific Europe and the Middle East The Sales Account Executive is responsible for driving new business building and maintaining customer loyalty ensuring high retention rates promoting our Customer centric cultureforward thinking strategies and initiatives The successful Sales Account Executive will leverage our three tiered sales model prospecting for new business and partnering with the internalexternal Sales teams providing our Customers with an experience exceeding expectations The team is made up of credible top performers who foster and entrepreneurial spirit and delivering predictable and consistent revenue growth Position Responsibilities Represent our comprehensive solution of end to end Wired  Wireless Data Networking Network Management and Security solutions growing revenue and profit margins within the assigned territory achieving properly aligned quotas Utilize your Solutions Sales expertise to prospect and capture new business while growing the existing install base Provide indepth business planning and reporting monthly forecast weekly commit pipeline development etc Develop strong mutually beneficial relationships with cross functional teams within the territory and across the company Requirements Proven hunter with a history of developing new prospective customers and collaborating across crossfunctional internal teams ensuring target quotas are achieved and exceeded Driven to successfully close large complex deals amid a mix of new business established accounts and channel management Strong executive presence and communications skills with effective Solution Selling skills into enterprise networking environments at the CXO levels Strong Business plan development and forecasting experience Must be a selfstarter with high energy and drive who takes initiative and works with limited direction A highly trusted business partner who maintains and expect high standards for self and team An accomplished Account Executive with established account base strong regional Customer and Channel Partner relationships Relevant industrycompetitive knowledge Proven and verifiable track record in exceeding sales quotas achieving Club Strong Competitive Industry and Product Knowledge with ability to articulate the Extreme Networks Business Value Proposition Additional Information Extreme Networks Inc EXTR creates effortless networking experiences that enable all of us to advance We push the boundaries of technology leveraging the powers of machine learning artificial intelligence analytics and automation Over 50000 customers globally trust
133753,Extreme Networks Named to Computerworlds 2023 List of Best Places to Work in IT Over 50000 customers globally trust our endtoend clouddriven networking solutions and rely on our toprated services and support to accelerate their digital transformation efforts and deliver progress like never before and with double digit growth year over year no provider is better positioned to deliver better outcomes on scale than Extreme We believe in walking the walkof our strong core values which enable us to successfully advance together Diversity and Inclusion is a vital part of our values and beliefs and were proud to foster an environment where every Extreme employee can thriveCome become part of something big with us We are a global leader with hubs in North America South America Asia Pacific Europe and the Middle East We are seeking bright articulate and selfmotivated candidates who have a desire to grow their sales career Selected candidates will have a strong work ethic and enthusiasm demonstrating initiative and professionalism Our Service Sales Managers are responsible for a targeted territorys service revenue selling service contract renewals upselling services and selling professional services and training Position Responsibilities Team with regionterritory Inside Service Account Manager Attain monthlyquarterlyannual quota on assigned regionterritory Weekly forecastingcommit  Service Organize andor attend weekly forecast calls with Regional director Team with Partners to crosssell and upsell services into existing customer base  create incremental pipeline and revenue Create proactive and reactive quotes for customers and partners as well as facilitate any special pricing requests Manage service contractsrenewals for customers in assigned regionterritory Manage service sales campaigns and promotions for assigned regionterritory Manage and interface with outsource company for service renewals Chase service renewal opportunities Regular pipeline and opportunity reporting both internally and externally Spot product upsell opportunities and work with the product account team Work with internal teams to guard data integrity and manage service orders Create and provide targeted presentations for internal and external audience ie customer meetings Attend and provide input for quarterly business reviews with the regionterritory management Develop and execute service sales strategies for the assigned regionterritory to increase service revenue Requirements Strong telephone communications skills comfortable calling on clients at the CXO level and beyond Should have a desire to pursue a career in Service Sales utilizing Consultative Sales techniques Ability to work well in a fast paced team environment BSBA preferred Service Sales experience Interest and knowledge of softwarehardware technologies preferred Experience with Computer Networking technologies a bonus Possess energetic and enthusiastic demeanor Experience with SalesForcecom is requiredStrong Microsoft Excel skills required Strong verbal and written skills in Spanish and English Team player LIRemote Additional Information Extreme Networks Inc EXTR creates effortless networking experiences that enable all of
